{
  "contractVersion": "video.world.catalog-execution-workflow.v1",
  "tenantId": "018f47c2-4a3b-7a10-8a11-000000000001",
  "projectId": "018f47c2-4a3b-7a10-8a11-000000000002",
  "executionPlanId": "018f47c2-4a3b-7a10-8a11-000000000007",
  "executionPartitionId": "018f47c2-4a3b-7a10-8a11-000000000008",
  "executionAttemptId": "018f47c2-4a3b-7a10-8a11-000000000009",
  "executionStage": "CATALOG_ENRICHMENT",
  "workloadDigest": "79c46dd8f1a6f38359cf1d712b00e0b0cc81bf283c4a406f5b84efd88fd37dde",
  "executionProfileDigest": "93c4bae1291829005dc81769b6e0587de702f050d9e56f8615fa37023f686c83",
  "dispatchSpecDigest": "c2eb869497aeb3e5cd01e158fa88c0668e8407896dfea755c15b555e9bb218eb",
  "inputs": [
    {
      "schemaVersion": "2.0.0",
      "objectRefId": "018f47c2-4a3b-7a10-8a11-000000000013",
      "tenantId": "018f47c2-4a3b-7a10-8a11-000000000001",
      "projectId": "018f47c2-4a3b-7a10-8a11-000000000002",
      "dataPlaneBindingId": "018f47c2-4a3b-7a10-8a11-000000000003",
      "dataPlaneId": "018f47c2-4a3b-7a10-8a11-000000000004",
      "provider": "ALIBABA_OSS",
      "uri": "oss://video-world-fixtures/execution/fixtures/object-ref.json",
      "objectKey": "execution/fixtures/object-ref.json",
      "format": "JSON",
      "mediaType": "application/json",
      "checksum": "7bc7957938233600aea3ae189c9d2d6af3343c03951b8336b71e8f6ea2fad6f5",
      "sizeBytes": 128,
      "etag": "standalone-etag",
      "versionToken": "standalone-version-1",
      "schemaDigest": "d30df95c01faa85a6ad1e2e8b2cc8c0a16658c19a6a427f20bd55ef48bc923e9",
      "encryptionContextDigest": "36ec5661379829161af913ac91de2871d391097c92ab21f1ba2c7bfffb5ec774",
      "createdAt": "2026-10-22T00:00:00Z",
      "identityDigest": "53a3a00755cc45f7e3c4cfd84cc693b453dd109f1bf10e5d625b631e52f9b422"
    }
  ],
  "transferPlanBinding": {
    "schemaVersion": "video.world.execution-transfer-plan.v1",
    "transferPlanId": "018f47c2-4a3b-7a10-8a11-000000000016",
    "tenantId": "018f47c2-4a3b-7a10-8a11-000000000001",
    "projectId": "018f47c2-4a3b-7a10-8a11-000000000002",
    "executionPlanId": "018f47c2-4a3b-7a10-8a11-000000000007",
    "executionPartitionId": "018f47c2-4a3b-7a10-8a11-000000000008",
    "sourceProvider": "AWS_S3",
    "targetProvider": "ALIBABA_OSS",
    "sourceObjectClosureDigest": "b2910608dcdef0db7e18beafc6268b91a8f341f3eb32f246497cda1c6908c5c3",
    "targetInputClosureDigest": "e9b3f16519872c84ac83e93de5c250aab2b1584c62385ff531a12289b296a973",
    "transferProfileDigest": "109d0de2245331990a461a412e5fbc34de59fd64fbaf94b142296f65ddb8a68b",
    "workloadIdentityDigest": "e105415cb7a4830bcd66f31c8a2142d0a56891f88210e7a7e80d10a54a29d7ab",
    "transferReceiptTenantId": "018f47c2-4a3b-7a10-8a11-000000000001",
    "transferReceiptId": "018f47c2-4a3b-7a10-8a11-000000000017",
    "transferReceiptSemanticDigest": "f22609ed9bf37cf0f17d443cc8322115243fdd94cfa7d85e95b41e9c13e8a2e3",
    "state": "VALIDATED",
    "validatedAt": "2026-10-23T00:00:01Z",
    "transferDigest": "5039c5c0138a3f990fb5353daa966ab8585f2b4fd77dd113e361ec3ace4c2b2c"
  },
  "requestDigest": "765815ced162f6531a0a748c37580d4d82c28a8dede65a227ae3e9fff4a1ae4e"
}
